"","ID","Description","GeneRatio","BgRatio","pvalue","p.adjust","qvalue"
"GO:0042110","GO:0042110","T cell activation","94/547","464/18670",3.58637742916757e-52,1.44853784364078e-48,1.19143233331083e-48
"GO:0030098","GO:0030098","lymphocyte differentiation","75/547","353/18670",4.88208516704195e-43,9.85937099484123e-40,8.10940041430758e-40
"GO:0030217","GO:0030217","T cell differentiation","58/547","240/18670",1.24462385761785e-36,1.67567858697283e-33,1.37825715601471e-33
"GO:0051249","GO:0051249","regulation of lymphocyte activation","78/547","485/18670",1.15809033073543e-35,1.09687863043778e-32,9.02190213226735e-33
"GO:0050863","GO:0050863","regulation of T cell activation","64/547","314/18670",1.35785916122528e-35,1.09687863043778e-32,9.02190213226735e-33
"GO:0007159","GO:0007159","leukocyte cell-cell adhesion","64/547","337/18670",1.13567757600212e-33,7.64500288245424e-31,6.28806742081171e-31
"GO:1903037","GO:1903037","regulation of leukocyte cell-cell adhesion","59/547","304/18670",1.28303983409723e-31,7.40313984274102e-29,6.08913340813664e-29
"GO:1903039","GO:1903039","positive regulation of leukocyte cell-cell adhesion","49/547","218/18670",1.75921639800279e-29,8.88184378941659e-27,7.30537756854843e-27
"GO:0022407","GO:0022407","regulation of cell-cell adhesion","63/547","403/18670",3.95357240401168e-28,1.77427543775591e-25,1.45935374351589e-25
"GO:0050870","GO:0050870","positive regulation of T cell activation","46/547","202/18670",5.38951932834477e-28,2.17682685671845e-25,1.79045505265854e-25
"GO:0022409","GO:0022409","positive regulation of cell-cell adhesion","50/547","255/18670",4.01898601248934e-27,1.47569859131313e-24,1.21377223496807e-24
"GO:0046651","GO:0046651","lymphocyte proliferation","50/547","272/18670",9.06763577056606e-26,3.05201507310969e-23,2.51030337648303e-23
"GO:0070661","GO:0070661","leukocyte proliferation","52/547","298/18670",1.19815536757099e-25,3.71324679838352e-23,3.05417101567569e-23
"GO:0032943","GO:0032943","mononuclear cell proliferation","50/547","274/18670",1.28708727846916e-25,3.71324679838352e-23,3.05417101567569e-23
"GO:0002696","GO:0002696","positive regulation of leukocyte activation","58/547","380/18670",2.14947105299603e-25,5.64850454977959e-23,4.64593381871604e-23
"GO:0050867","GO:0050867","positive regulation of cell activation","59/547","394/18670",2.23758536262623e-25,5.64850454977959e-23,4.64593381871604e-23
"GO:0051251","GO:0051251","positive regulation of lymphocyte activation","54/547","334/18670",6.23174833680339e-25,1.48059009013817e-22,1.21779552637471e-22
"GO:0002449","GO:0002449","lymphocyte mediated immunity","54/547","352/18670",8.38399452837063e-24,1.88127521667161e-21,1.54736179716595e-21
"GO:0050670","GO:0050670","regulation of lymphocyte proliferation","41/547","208/18670",1.65066216923417e-22,3.50896026396675e-20,2.8861439368992e-20
"GO:0032944","GO:0032944","regulation of mononuclear cell proliferation","41/547","209/18670",1.99873286833262e-22,4.03644102759772e-20,3.32000049076723e-20
"GO:0070663","GO:0070663","regulation of leukocyte proliferation","42/547","222/18670",2.62911944695949e-22,5.05667306965208e-20,4.15914835819757e-20
"GO:0046631","GO:0046631","alpha-beta T cell activation","34/547","138/18670",3.64652412695577e-22,6.69468679489744e-20,5.50642590654183e-20
"GO:0045058","GO:0045058","T cell selection","22/547","47/18670",9.22446204289973e-22,1.61989574744661e-19,1.33237538706598e-19
"GO:0042113","GO:0042113","B cell activation","48/547","310/18670",1.96257723287739e-21,3.30285393482991e-19,2.7166200644566e-19
"GO:0045785","GO:0045785","positive regulation of cell adhesion","54/547","403/18670",5.6512326591369e-21,9.13013148410158e-19,7.5095959040994e-19
"GO:0050851","GO:0050851","antigen receptor-mediated signaling pathway","47/547","316/18670",2.89854082916362e-20,4.5027716957661e-18,3.70356067078558e-18
"GO:0045619","GO:0045619","regulation of lymphocyte differentiation","35/547","169/18670",4.05984410177268e-20,5.85972260527487e-18,4.81966212122529e-18
"GO:0002460","GO:0002460","adaptive immune response based on somatic recombination of immune receptors built from immunoglobulin superfamily domains","50/547","361/18670",4.06219937973995e-20,5.85972260527487e-18,4.81966212122529e-18
"GO:0050900","GO:0050900","leukocyte migration","59/547","499/18670",4.2399447055162e-20,5.90521953985515e-18,4.85708366265304e-18
"GO:0043368","GO:0043368","positive T cell selection","18/547","34/18670",2.74111244784904e-19,3.6904510589541e-17,3.03542136330231e-17
"GO:0002429","GO:0002429","immune response-activating cell surface receptor signaling pathway","56/547","473/18670",3.81374609123102e-19,4.96894208467165e-17,4.08698902000853e-17
"GO:0002706","GO:0002706","regulation of lymphocyte mediated immunity","32/547","149/18670",5.35410609591672e-19,6.75788578793988e-17,5.55840751273459e-17
"GO:0046632","GO:0046632","alpha-beta T cell differentiation","27/547","101/18670",7.42551548696089e-19,9.0883809247985e-17,7.47525578208886e-17
"GO:0042129","GO:0042129","regulation of T cell proliferation","32/547","156/18670",2.28757832420915e-18,2.71750848572964e-16,2.23516940904151e-16
"GO:0002699","GO:0002699","positive regulation of immune effector process","37/547","216/18670",2.85977626979981e-18,3.30018181534898e-16,2.714422227816e-16
"GO:1902105","GO:1902105","regulation of leukocyte differentiation","41/547","272/18670",4.99075552830074e-18,5.59935043855741e-16,4.60550422436174e-16
"GO:0045580","GO:0045580","regulation of T cell differentiation","30/547","139/18670",5.94259035335739e-18,6.487060118165e-16,5.33565153775133e-16
"GO:0002697","GO:0002697","regulation of immune effector process","53/547","458/18670",9.93896356425993e-18,1.05640720621173e-15,8.68902188609538e-16
"GO:0002703","GO:0002703","regulation of leukocyte mediated immunity","35/547","201/18670",1.39779019337136e-17,1.44760886949408e-15,1.19066824568961e-15
"GO:0042102","GO:0042102","positive regulation of T cell proliferation","25/547","95/18670",2.2461052217138e-17,2.26800474762551e-15,1.86544949466546e-15
"GO:0042098","GO:0042098","T cell proliferation","33/547","184/18670",4.79594952980485e-17,4.72459515875166e-15,3.88601199385472e-15
"GO:0001819","GO:0001819","positive regulation of cytokine production","52/547","464/18670",8.14742281142555e-17,7.83510493698757e-15,6.44442766738322e-15
"GO:0002285","GO:0002285","lymphocyte activation involved in immune response","32/547","181/18670",2.22773220656053e-16,2.09251404239488e-14,1.72110718333048e-14
"GO:0002708","GO:0002708","positive regulation of lymphocyte mediated immunity","25/547","105/18670",2.9951165290081e-16,2.74938083196903e-14,2.2613846329066e-14
"GO:0070665","GO:0070665","positive regulation of leukocyte proliferation","28/547","139/18670",5.1638026002467e-16,4.63479971164365e-14,3.81215462137511e-14
"GO:0050671","GO:0050671","positive regulation of lymphocyte proliferation","27/547","130/18670",7.71068195865179e-16,6.77031400673795e-14,5.56862980812473e-14
"GO:0031295","GO:0031295","T cell costimulation","19/547","56/18670",8.44887264284322e-16,7.26063757541356e-14,5.97192431373196e-14
"GO:0032946","GO:0032946","positive regulation of mononuclear cell proliferation","27/547","131/18670",9.45092375035101e-16,7.95255854743078e-14,6.54103406932188e-14
"GO:0031294","GO:0031294","lymphocyte costimulation","19/547","57/18670",1.23327460247924e-15,1.01657063661503e-13,8.36136336288823e-14
"GO:0002683","GO:0002683","negative regulation of immune system process","50/547","463/18670",1.4936040993429e-15,1.2065333914492e-13,9.92382007900253e-14
"GO:0042100","GO:0042100","B cell proliferation","23/547","95/18670",3.16629522650644e-15,2.50758165095285e-13,2.06250314444878e-13
"GO:0033077","GO:0033077","T cell differentiation in thymus","20/547","70/18670",6.39192710620698e-15,4.96480645807115e-13,4.08358743870227e-13
"GO:0032609","GO:0032609","interferon-gamma production","24/547","113/18670",1.8672389618378e-14,1.42297701261564e-12,1.17040837409337e-12
"GO:0002819","GO:0002819","regulation of adaptive immune response","28/547","160/18670",2.25002011726797e-14,1.68293171363803e-12,1.38422290255316e-12
"GO:0031341","GO:0031341","regulation of cell killing","22/547","98/18670",6.87653203130336e-14,5.04987506807896e-12,4.15355695517577e-12
"GO:0002705","GO:0002705","positive regulation of leukocyte mediated immunity","25/547","133/18670",1.03612101843921e-13,7.47302284549281e-12,6.14661265825968e-12
"GO:0072676","GO:0072676","lymphocyte migration","23/547","111/18670",1.15268119404314e-13,8.1678584960355e-12,6.71811975697164e-12
"GO:0050852","GO:0050852","T cell receptor signaling pathway","30/547","202/18670",2.39990106857833e-13,1.67124145103239e-11,1.37460758120385e-11
"GO:0043367","GO:0043367","CD4-positive, alpha-beta T cell differentiation","19/547","74/18670",2.6100032398492e-13,1.78674628572049e-11,1.4696111016885e-11
"GO:0001909","GO:0001909","leukocyte mediated cytotoxicity","22/547","107/18670",4.6843898724273e-13,3.15337511578898e-11,2.59367270831238e-11
"GO:0031343","GO:0031343","positive regulation of cell killing","18/547","68/18670",6.28034389389182e-13,4.1584113094146e-11,3.4203218859573e-11
"GO:0001910","GO:0001910","regulation of leukocyte mediated cytotoxicity","19/547","78/18670",7.33606166155638e-13,4.77908920177842e-11,3.93083371882376e-11
"GO:0002822","GO:0002822","regulation of adaptive immune response based on somatic recombination of immune receptors built from immunoglobulin superfamily domains","25/547","145/18670",8.0002907418432e-13,5.12907528671503e-11,4.21869967940804e-11
"GO:0007204","GO:0007204","positive regulation of cytosolic calcium ion concentration","37/547","319/18670",9.6234947502916e-13,6.07332739006684e-11,4.99535352498689e-11
"GO:1903706","GO:1903706","regulation of hemopoiesis","46/547","475/18670",1.12327997506909e-12,6.97988895277545e-11,5.74100664181059e-11
"GO:0032649","GO:0032649","regulation of interferon-gamma production","21/547","101/18670",1.26804199326929e-12,7.76003274365856e-11,6.3826802723411e-11
"GO:0046634","GO:0046634","regulation of alpha-beta T cell activation","20/547","93/18670",2.24396305598449e-12,1.35274131091363e-10,1.11263902665939e-10
"GO:0045061","GO:0045061","thymic T cell selection","11/547","21/18670",3.34357366328146e-12,1.95801255921537e-10,1.61047878888305e-10
"GO:0001912","GO:0001912","positive regulation of leukocyte mediated cytotoxicity","16/547","56/18670",3.34495832101661e-12,1.95801255921537e-10,1.61047878888305e-10
"GO:0001906","GO:0001906","cell killing","26/547","168/18670",3.68236011515284e-12,2.10206918408492e-10,1.72896635305039e-10
"GO:0030595","GO:0030595","leukocyte chemotaxis","30/547","224/18670",3.69514513666821e-12,2.10206918408492e-10,1.72896635305039e-10
"GO:1990868","GO:1990868","response to chemokine","20/547","97/18670",5.15212224854291e-12,2.8506057208034e-10,2.34464279976949e-10
"GO:1990869","GO:1990869","cellular response to chemokine","20/547","97/18670",5.15212224854291e-12,2.8506057208034e-10,2.34464279976949e-10
"GO:0051480","GO:0051480","regulation of cytosolic calcium ion concentration","38/547","357/18670",6.67752620779187e-12,3.64466599368532e-10,2.99776283240272e-10
"GO:0070098","GO:0070098","chemokine-mediated signaling pathway","19/547","88/18670",7.41752842576101e-12,3.99458630821983e-10,3.28557469637919e-10
"GO:0002695","GO:0002695","negative regulation of leukocyte activation","26/547","175/18670",9.58114644978656e-12,5.09187506719578e-10,4.1881022431477e-10
"GO:0035710","GO:0035710","CD4-positive, alpha-beta T cell activation","19/547","92/18670",1.70779068965795e-11,8.95813843575123e-10,7.36813043959054e-10
"GO:0046635","GO:0046635","positive regulation of alpha-beta T cell activation","16/547","62/18670",1.86588895240119e-11,9.66195574198512e-10,7.94702501184635e-10
"GO:0002440","GO:0002440","production of molecular mediator of immune response","33/547","286/18670",1.93678522408172e-11,9.90212091147602e-10,8.14456251459281e-10
"GO:0060326","GO:0060326","cell chemotaxis","34/547","304/18670",2.27114945031111e-11,1.14664657872582e-09,9.43124692787088e-10
"GO:0002821","GO:0002821","positive regulation of adaptive immune response","20/547","105/18670",2.40050937230658e-11,1.19699473515386e-09,9.84536397530808e-10
"GO:0045621","GO:0045621","positive regulation of lymphocyte differentiation","19/547","94/18670",2.5475196426247e-11,1.25480876055624e-09,1.03208883082459e-09
"GO:0002286","GO:0002286","T cell activation involved in immune response","20/547","106/18670",2.87927025059711e-11,1.40112922194719e-09,1.15243841609188e-09
"GO:1902107","GO:1902107","positive regulation of leukocyte differentiation","23/547","144/18670",3.37895156750667e-11,1.62471254537612e-09,1.33633723647256e-09
"GO:0032729","GO:0032729","positive regulation of interferon-gamma production","16/547","65/18670",4.07840152602358e-11,1.93796044277756e-09,1.59398578527931e-09
"GO:0042108","GO:0042108","positive regulation of cytokine biosynthetic process","16/547","67/18670",6.69950063203038e-11,3.14642826195008e-09,2.58795887327881e-09
"GO:0002824","GO:0002824","positive regulation of adaptive immune response based on somatic recombination of immune receptors built from immunoglobulin superfamily domains","19/547","100/18670",7.94784404004192e-11,3.68980943422176e-09,3.03489362254958e-09
"GO:0002377","GO:0002377","immunoglobulin production","26/547","193/18670",9.04591675695565e-11,4.15187020242544e-09,3.41494178049666e-09
"GO:0042035","GO:0042035","regulation of cytokine biosynthetic process","20/547","114/18670",1.1448374562549e-10,5.19550391664444e-09,4.27333768414012e-09
"GO:0055074","GO:0055074","calcium ion homeostasis","42/547","471/18670",1.54646742384452e-10,6.94020213878669e-09,5.7083639645068e-09
"GO:0050853","GO:0050853","B cell receptor signaling pathway","21/547","129/18670",1.68547180109777e-10,7.35520974924344e-09,6.04971057677442e-09
"GO:0002287","GO:0002287","alpha-beta T cell activation involved in immune response","15/547","61/18670",1.69357392096965e-10,7.35520974924344e-09,6.04971057677442e-09
"GO:0002293","GO:0002293","alpha-beta T cell differentiation involved in immune response","15/547","61/18670",1.69357392096965e-10,7.35520974924344e-09,6.04971057677442e-09
"GO:0050866","GO:0050866","negative regulation of cell activation","26/547","199/18670",1.79952744187897e-10,7.73222482739271e-09,6.35980807006721e-09
"GO:0002456","GO:0002456","T cell mediated immunity","19/547","106/18670",2.28059825447228e-10,9.59418037176642e-09,7.89127930396915e-09
"GO:0006874","GO:0006874","cellular calcium ion homeostasis","41/547","458/18670",2.29157643370802e-10,9.59418037176642e-09,7.89127930396915e-09
"GO:0043383","GO:0043383","negative T cell selection","8/547","12/18670",2.30412353568047e-10,9.59418037176642e-09,7.89127930396915e-09
"GO:0043373","GO:0043373","CD4-positive, alpha-beta T cell lineage commitment","9/547","17/18670",2.93907186865284e-10,1.21131747729478e-08,9.96316951392949e-09
"GO:0002228","GO:0002228","natural killer cell mediated immunity","15/547","64/18670",3.53170200348601e-10,1.44086306990707e-08,1.18511977916022e-08
"GO:0050854","GO:0050854","regulation of antigen receptor-mediated signaling pathway","15/547","65/18670",4.46886055875115e-10,1.787101762059e-08,1.46990348342039e-08
"GO:0072678","GO:0072678","T cell migration","15/547","65/18670",4.46886055875115e-10,1.787101762059e-08,1.46990348342039e-08
"GO:0042089","GO:0042089","cytokine biosynthetic process","20/547","123/18670",4.69833530923929e-10,1.86044865823701e-08,1.53023180969651e-08
"GO:0042107","GO:0042107","cytokine metabolic process","20/547","124/18670",5.4514274383767e-10,2.13770052656345e-08,1.75827337716064e-08
"GO:0002292","GO:0002292","T cell differentiation involved in immune response","15/547","68/18670",8.816346964254e-10,3.42396397967518e-08,2.81623390882446e-08
"GO:0050864","GO:0050864","regulation of B cell activation","24/547","184/18670",9.40130297692661e-10,3.61636787845777e-08,2.97448743811332e-08
"GO:0002363","GO:0002363","alpha-beta T cell lineage commitment","9/547","19/18670",1.05974906450705e-09,4.03804384107924e-08,3.32131881587315e-08
"GO:0002294","GO:0002294","CD4-positive, alpha-beta T cell differentiation involved in immune response","14/547","60/18670",1.46315453526127e-09,5.52306651207501e-08,4.54276017047178e-08
"GO:0030183","GO:0030183","B cell differentiation","20/547","131/18670",1.48053869145854e-09,5.53694053222318e-08,4.55417164741047e-08
"GO:0002360","GO:0002360","T cell lineage commitment","10/547","26/18670",1.49559959284813e-09,5.54195115184733e-08,4.55829291649319e-08
"GO:0030888","GO:0030888","regulation of B cell proliferation","14/547","61/18670",1.84854091833151e-09,6.78750615376453e-08,5.58277046722895e-08
"GO:0043369","GO:0043369","CD4-positive or CD8-positive, alpha-beta T cell lineage commitment","9/547","20/18670",1.87693386738894e-09,6.82967197331885e-08,5.61745214365053e-08
"GO:0045582","GO:0045582","positive regulation of T cell differentiation","16/547","83/18670",1.99890596013079e-09,7.20855461872167e-08,5.9290857238466e-08
"GO:0072503","GO:0072503","cellular divalent inorganic cation homeostasis","41/547","493/18670",2.06940034502446e-09,7.39673273765822e-08,6.08386352016506e-08
"GO:0002237","GO:0002237","response to molecule of bacterial origin","33/547","343/18670",2.28670957919554e-09,8.10177192137787e-08,6.66376309505181e-08
"GO:0046637","GO:0046637","regulation of alpha-beta T cell differentiation","14/547","63/18670",2.90898224292343e-09,1.01889279831991e-07,8.38046330253097e-08
"GO:0006968","GO:0006968","cellular defense response","13/547","53/18670",2.92625809866576e-09,1.01889279831991e-07,8.38046330253097e-08
"GO:0032496","GO:0032496","response to lipopolysaccharide","32/547","330/18670",3.31200382642954e-09,1.1433490132435e-07,9.40412422511167e-08
"GO:0071219","GO:0071219","cellular response to molecule of bacterial origin","25/547","212/18670",3.52449158066664e-09,1.20639165206039e-07,9.92265426278672e-08
"GO:0002700","GO:0002700","regulation of production of molecular mediator of immune response","20/547","139/18670",4.27488131496631e-09,1.45094501102092e-07,1.1934122450273e-07
"GO:0045060","GO:0045060","negative thymic T cell selection","7/547","11/18670",5.31669223513659e-09,1.78765463998159e-07,1.47035822931208e-07
"GO:1903708","GO:1903708","positive regulation of hemopoiesis","23/547","185/18670",5.3988139396236e-09,1.78765463998159e-07,1.47035822931208e-07
"GO:0002295","GO:0002295","T-helper cell lineage commitment","8/547","16/18670",5.39969958102883e-09,1.78765463998159e-07,1.47035822931208e-07
"GO:0002715","GO:0002715","regulation of natural killer cell mediated immunity","12/547","46/18670",5.56718392764899e-09,1.82811836453449e-07,1.50363992089518e-07
"GO:0002381","GO:0002381","immunoglobulin production involved in immunoglobulin mediated immune response","13/547","56/18670",6.06464860425788e-09,1.97541255746755e-07,1.62479040704906e-07
"GO:0019722","GO:0019722","calcium-mediated signaling","25/547","218/18670",6.2706528174946e-09,2.02617333838886e-07,1.66654149827478e-07
"GO:0043370","GO:0043370","regulation of CD4-positive, alpha-beta T cell differentiation","12/547","47/18670",7.27887909004108e-09,2.31860630795226e-07,1.90706962585771e-07
"GO:0071216","GO:0071216","cellular response to biotic stimulus","26/547","236/18670",7.29049272369243e-09,2.31860630795226e-07,1.90706962585771e-07
"GO:0019724","GO:0019724","B cell mediated immunity","25/547","221/18670",8.29699952485405e-09,2.61809227194418e-07,2.15339888983876e-07
"GO:0071222","GO:0071222","cellular response to lipopolysaccharide","24/547","205/18670",8.38457813964226e-09,2.62521791519497e-07,2.15925978039257e-07
"GO:0042093","GO:0042093","T-helper cell differentiation","13/547","58/18670",9.59732088935817e-09,2.98181377477828e-07,2.45256232605784e-07
"GO:0051250","GO:0051250","negative regulation of lymphocyte activation","20/547","146/18670",1.01471316632134e-08,3.1285698311236e-07,2.57327019116928e-07
"GO:0072540","GO:0072540","T-helper 17 cell lineage commitment","7/547","12/18670",1.24374840693326e-08,3.78235674508189e-07,3.11101442188099e-07
"GO:0002709","GO:0002709","regulation of T cell mediated immunity","14/547","70/18670",1.24549008936839e-08,3.78235674508189e-07,3.11101442188099e-07
"GO:0042267","GO:0042267","natural killer cell mediated cytotoxicity","13/547","60/18670",1.48939421549931e-08,4.48930092268785e-07,3.69248086733372e-07
"GO:0002685","GO:0002685","regulation of leukocyte migration","23/547","196/18670",1.64135361019595e-08,4.91068683820847e-07,4.03907367935939e-07
"GO:0006959","GO:0006959","humoral immune response","32/547","356/18670",2.07215148921371e-08,6.15398519480453e-07,5.06169512380685e-07
"GO:0045059","GO:0045059","positive thymic T cell selection","7/547","13/18670",2.62668876980133e-08,7.74393864323181e-07,6.36944276411295e-07
"GO:0032103","GO:0032103","positive regulation of response to external stimulus","30/547","323/18670",2.76383486900076e-08,8.08922393905367e-07,6.65344229333821e-07
"GO:0045076","GO:0045076","regulation of interleukin-2 biosynthetic process","8/547","19/18670",2.9336769024711e-08,8.46552140518942e-07,6.96294954581718e-07
"GO:0019932","GO:0019932","second-messenger-mediated signaling","36/547","439/18670",2.93432284408645e-08,8.46552140518942e-07,6.96294954581718e-07
"GO:0042269","GO:0042269","regulation of natural killer cell mediated cytotoxicity","11/547","44/18670",3.94303629012869e-08,1.12949812594538e-06,9.29019972500646e-07
"GO:0045088","GO:0045088","regulation of innate immune response","36/547","452/18670",6.14490522754935e-08,1.74783607141351e-06,1.43760718296114e-06
"GO:0001773","GO:0001773","myeloid dendritic cell activation","9/547","28/18670",6.25882771333836e-08,1.76779056882333e-06,1.45401989424335e-06
"GO:0046638","GO:0046638","positive regulation of alpha-beta T cell differentiation","11/547","47/18670",8.26921087011155e-08,2.31939879891532e-06,1.90772145512223e-06
"GO:0042094","GO:0042094","interleukin-2 biosynthetic process","8/547","22/18670",1.14832540798092e-07,3.19868022264479e-06,2.63093647011818e-06
"GO:0016064","GO:0016064","immunoglobulin mediated immune response","23/547","218/18670",1.19799612773772e-07,3.31418243831003e-06,2.72593783643853e-06
"GO:0045954","GO:0045954","positive regulation of natural killer cell mediated cytotoxicity","9/547","30/18670",1.23036030116806e-07,3.38056139892367e-06,2.78053498781697e-06
"GO:2000514","GO:2000514","regulation of CD4-positive, alpha-beta T cell activation","12/547","61/18670",1.67026738268149e-07,4.55824997206117e-06,3.7491919343832e-06
"GO:0002312","GO:0002312","B cell activation involved in immune response","13/547","73/18670",1.7555337696052e-07,4.75879254727209e-06,3.91413958097776e-06
"GO:0001776","GO:0001776","leukocyte homeostasis","14/547","86/18670",1.90257170905074e-07,5.12299142190396e-06,4.21369565878185e-06
"GO:0032623","GO:0032623","interleukin-2 production","12/547","62/18670",2.01665337324571e-07,5.39421389042347e-06,4.43677800346007e-06
"GO:1903038","GO:1903038","negative regulation of leukocyte cell-cell adhesion","17/547","129/18670",2.29524240980694e-07,6.09900269290148e-06,5.01647163805451e-06
"GO:0002637","GO:0002637","regulation of immunoglobulin production","12/547","63/18670",2.42564308509531e-07,6.40338066712414e-06,5.26682461407691e-06
"GO:0050857","GO:0050857","positive regulation of antigen receptor-mediated signaling pathway","8/547","24/18670",2.50783462857462e-07,6.57736627585252e-06,5.40992897319309e-06
"GO:0002717","GO:0002717","positive regulation of natural killer cell mediated immunity","9/547","33/18670",3.06634771089566e-07,7.93908872070999e-06,6.52995504425554e-06
"GO:0032633","GO:0032633","interleukin-4 production","9/547","33/18670",3.06634771089566e-07,7.93908872070999e-06,6.52995504425554e-06
"GO:0050727","GO:0050727","regulation of inflammatory response","36/547","485/18670",3.48436455333795e-07,8.9382609977433e-06,7.35178111019608e-06
"GO:1990266","GO:1990266","neutrophil migration","16/547","118/18670",3.49652200456411e-07,8.9382609977433e-06,7.35178111019608e-06
"GO:0030593","GO:0030593","neutrophil chemotaxis","15/547","104/18670",3.59170445135661e-07,9.07198038606355e-06,7.46176622624583e-06
"GO:0050901","GO:0050901","leukocyte tethering or rolling","8/547","25/18670",3.59375306207024e-07,9.07198038606355e-06,7.46176622624583e-06
"GO:0032655","GO:0032655","regulation of interleukin-12 production","11/547","54/18670",3.77461436268269e-07,9.39156362378918e-06,7.7246256360169e-06
"GO:0032663","GO:0032663","regulation of interleukin-2 production","11/547","54/18670",3.77461436268269e-07,9.39156362378918e-06,7.7246256360169e-06
"GO:0022408","GO:0022408","negative regulation of cell-cell adhesion","20/547","181/18670",3.79010861767179e-07,9.39156362378918e-06,7.7246256360169e-06
"GO:0045066","GO:0045066","regulatory T cell differentiation","9/547","34/18670",4.06263465121241e-07,1.00054764367359e-05,8.22957314456122e-06
"GO:0050777","GO:0050777","negative regulation of immune response","18/547","150/18670",4.24921937502425e-07,1.04015739731654e-05,8.55536609095792e-06
"GO:0072539","GO:0072539","T-helper 17 cell differentiation","8/547","26/18670",5.05837264707005e-07,1.23076910370578e-05,1.01231604782201e-05
"GO:0032615","GO:0032615","interleukin-12 production","11/547","56/18670",5.56850912114251e-07,1.34677894253261e-05,1.10773493768205e-05
"GO:0045086","GO:0045086","positive regulation of interleukin-2 biosynthetic process","6/547","13/18670",8.86344778384708e-07,2.13092057136657e-05,1.75269681740736e-05
"GO:0050868","GO:0050868","negative regulation of T cell activation","15/547","112/18670",9.52840011551338e-07,2.27723124654193e-05,1.87303835344505e-05
"GO:0097529","GO:0097529","myeloid leukocyte migration","21/547","210/18670",1.02823011144069e-06,2.44295377653467e-05,2.00934627350267e-05
